<?xml version="1.0" encoding="ISO-8859-1"?>

<!ELEMENT ModelParameterList (ModelParameters)+ >
<!ELEMENT ModelParameters (Par)+ >
<!ELEMENT Par (#PCDATA) >

<!ATTLIST ModelParameters
  Id	CDATA	#REQUIRED
>

<!ATTLIST Par
  Id	CDATA	#REQUIRED
  Name  CDATA	#REQUIRED
>
