<?xml version="1.0" encoding="ISO-8859-1"?>
<!DOCTYPE ModelParameterList PUBLIC "" "model_config.dtd" []>
<ModelParameterList>
  <ModelParameters Id="EarthA">
    <Par Id="0" Name="MaxPars">
      5.0
    </Par>
    <Par Id="1" Name="H1">
      3.40e-13
    </Par>
    <Par Id="2" Name="H2">
      8.69e-13
    </Par>
    <Par Id="3" Name="L1.m">
      2.885e6
    </Par>
    <Par Id="4" Name="L2.m">
      8.17e6
    </Par>
    <Par Id="5" Name="M.to.invEV">
      5.076e+6
    </Par>
    <Par Id="6" Name="LMIN">
      0.0
    </Par>
    <Par Id="7" Name="LMAX">
      7.0780e13
    </Par>
    <Par Id="8" Name="Emin">
      1.0e9
    </Par>
    <Par Id="9" Name="Emax">
      1.0e10
    </Par>
    <Par Id="10" Name="Dx">
      1.0e10
    </Par>
    <Par Id="11" Name="De">
      1.0e8
    </Par>
  </ModelParameters>
  <ModelParameters Id="EarthB">
    <Par Id="0" Name="MaxPars">
      3.0
    </Par>
    <Par Id="1" Name="Diameter">
      7.0780e13
    </Par>
    <Par Id="2" Name="cFact1">
      4.2951e+18
    </Par>
    <Par Id="3" Name="cFact2">
      1.76e-32
    </Par>
    <Par Id="4" Name="LMIN">
      0.0
    </Par>
    <Par Id="5" Name="LMAX">
      7.0780e13
    </Par>
    <Par Id="6" Name="Emin">
      1.0e9
    </Par>
    <Par Id="7" Name="Emax">
      1.0e10
    </Par>
    <Par Id="8" Name="Dx">
      1.0e10
    </Par>
    <Par Id="9" Name="De">
      1.0e8
    </Par>
  </ModelParameters>
  <ModelParameters Id="ZeroPt">
    <Par Id="0" Name="MaxPars">
      0.0
    </Par>
    <Par Id="2" Name="LMAX">
      1.61e+17
    </Par>
    <Par Id="3" Name="LMIN">
      3.20e+15
    </Par>
    <Par Id="4" Name="Emin">
      1.0e11
    </Par>
    <Par Id="5" Name="Emax">
      1.0e14
    </Par>
    <Par Id="6" Name="Dx">
      0.5e14
    </Par>
    <Par Id="7" Name="De">
      1.0e9
    </Par>
  </ModelParameters>
 </ModelParameterList>
